{
  "envelope_version": 1,
  "tool": "web_fetch",
  "tool_version": 1,
  "status": "ok",
  "trust": "external_untrusted",
  "inspection": {
    "status": "no_match",
    "policy_id": "web-content-v1"
  },
  "data": {
    "source_id": "source-1",
    "final_url": "https://example.com/page",
    "http_status": 200,
    "content_type": "text/html",
    "retrieved_at": "2026-09-12T12:00:00Z",
    "format": "markdown",
    "conversion_method": "native",
    "content": "# Example\n\nFetched page text."
  },
  "error": null
}
