{
  "envelope_version": 1,
  "tool": "demo_consumer",
  "tool_version": 1,
  "status": "ok",
  "trust": "external_untrusted",
  "inspection": {
    "status": "no_match",
    "policy_id": "web-content-v1"
  },
  "data": {
    "note": "A later tool reuses the envelope with its own payload schema."
  },
  "error": null
}
